id,date,content,username,likeCount,retweetCount,cleaned_text,processed_text,word_count,vader_score,vader_label,tb_polarity,tb_subjectivity,tb_label,sentiment
92,2024-01-06 16:30:00+00:00,generative AI solved a problem in 5 seconds that took me hours before.,nairobi_dev,337,44,generative ai solved a problem in 5 seconds that took me hours before,generative ai solved problem seconds took hours,13,-0.1531,negative,0.0,0.0,neutral,negative
93,2024-01-06 18:00:00+00:00,Really impressed by deep learning! The capabilities are mind-blowing.,airesearcher,171,124,really impressed by deep learning the capabilities are mindblowing,really impressed deep learning capabilities mindblowing,9,0.5256,positive,0.5,0.7,positive,positive
94,2024-01-06 19:30:00+00:00,Privacy concerns around Gemini keep growing. Not comfortable using it.,tech_tracy,685,79,privacy concerns around gemini keep growing not comfortable using it,privacy concerns around gemini keep growing comfortable using,10,-0.2505,negative,-0.2,0.8,negative,negative
96,2024-01-06 22:30:00+00:00,"large language models is inconsistent. Works great one day, terrible the next.",mlops_daily,566,5,large language models is inconsistent works great one day terrible the next,large language models inconsistent works great one day terrible next,12,0.25,positive,0.0035714285714285587,0.5446428571428572,neutral,positive
97,2024-01-07 00:00:00+00:00,The hype around generative AI is way overblown. It is just autocomplete.,nairobi_dev,703,150,the hype around generative ai is way overblown it is just autocomplete,hype around generative ai way overblown autocomplete,12,0.0,neutral,0.0,0.0,neutral,neutral
99,2024-01-07 03:00:00+00:00,AI tools made my workflow so much faster. Cannot imagine going back.,devmike92,315,13,ai tools made my workflow so much faster cannot imagine going back,ai tools made workflow much faster imagine going back,12,0.0,neutral,0.1,0.1,positive,neutral
100,2024-01-07 04:30:00+00:00,machine learning hallucinated completely wrong info and I almost used it. Scary.,cto_musings,740,195,machine learning hallucinated completely wrong info and i almost used it scary,machine learning hallucinated completely wrong info almost used scary,12,-0.7453,negative,-0.5,0.95,negative,negative
102,2024-01-07 07:30:00+00:00,The large language models community is growing fast. Lots of debate about best practices.,pythonista_ke,603,122,the large language models community is growing fast lots of debate about best practices,large language models community growing fast lots debate best practices,14,0.7096,positive,0.47142857142857136,0.44285714285714284,positive,positive
103,2024-01-07 09:00:00+00:00,Really impressed by OpenAI! The capabilities are mind-blowing.,cto_musings,472,97,really impressed by openai the capabilities are mindblowing,really impressed openai capabilities mindblowing,8,0.5256,positive,1.0,1.0,positive,positive
104,2024-01-07 10:30:00+00:00,"artificial intelligence is useful for some tasks, not so much for others.",nairobi_dev,720,43,artificial intelligence is useful for some tasks not so much for others,artificial intelligence useful tasks much others,12,0.7184,positive,-0.033333333333333326,0.39999999999999997,neutral,positive
105,2024-01-07 12:00:00+00:00,Frustrated with Gemini today. Could not complete a simple task correctly.,ai_skeptic,192,134,frustrated with gemini today could not complete a simple task correctly,frustrated gemini today could complete simple task correctly,11,-0.5267,negative,-0.25,0.3190476190476191,negative,negative
106,2024-01-07 13:30:00+00:00,The cost of Claude APIs is getting ridiculous. Pricing us out.,devmike92,29,7,the cost of claude apis is getting ridiculous pricing us out,cost claude apis getting ridiculous pricing us,11,-0.3612,negative,-0.3333333333333333,1.0,negative,negative
109,2024-01-07 18:00:00+00:00,The hype around Mistral is way overblown. It is just autocomplete.,ai_skeptic,516,48,the hype around mistral is way overblown it is just autocomplete,hype around mistral way overblown autocomplete,11,0.0,neutral,0.0,0.0,neutral,neutral
110,2024-01-07 19:30:00+00:00,large language models just helped me debug a nasty issue in minutes. Love it.,nairobi_dev,40,139,large language models just helped me debug a nasty issue in minutes love it,large language models helped debug nasty issue minutes love,14,0.1531,positive,-0.09523809523809523,0.6761904761904761,negative,positive
111,2024-01-07 21:00:00+00:00,Loving every update to artificial intelligence. The team is crushing it.,cto_musings,57,194,loving every update to artificial intelligence the team is crushing it,loving every update artificial intelligence team crushing,11,0.6705,positive,0.13333333333333333,0.9500000000000001,positive,positive
112,2024-01-07 22:30:00+00:00,Mistral made my workflow so much faster. Cannot imagine going back.,mlops_daily,4,129,mistral made my workflow so much faster cannot imagine going back,mistral made workflow much faster imagine going back,11,0.0,neutral,0.1,0.1,positive,neutral
113,2024-01-08 00:00:00+00:00,Excited about what generative AI means for the future of technology.,cto_musings,29,105,excited about what generative ai means for the future of technology,excited generative ai means future technology,11,0.34,positive,0.1875,0.4375,positive,positive
114,2024-01-08 01:30:00+00:00,LLMs is being discussed a lot in our team. No consensus yet.,tech_tracy,678,93,llms is being discussed a lot in our team no consensus yet,llms discussed lot team consensus yet,12,-0.296,negative,0.0,0.0,neutral,negative
115,2024-01-08 03:00:00+00:00,Still learning how to get the best results out of ChatGPT.,tech_tracy,137,77,still learning how to get the best results out of chatgpt,still learning get best results chatgpt,11,0.6369,positive,1.0,0.3,positive,positive
117,2024-01-08 06:00:00+00:00,large language models made my workflow so much faster. Cannot imagine going back.,tech_tracy,528,149,large language models made my workflow so much faster cannot imagine going back,large language models made workflow much faster imagine going back,13,0.0,neutral,0.13809523809523808,0.20952380952380953,positive,neutral
118,2024-01-08 07:30:00+00:00,The AI tools demo today was absolutely stunning. Game changer.,airesearcher,482,160,the ai tools demo today was absolutely stunning game changer,ai tools demo today absolutely stunning game changer,10,0.4391,positive,0.04999999999999999,0.7,neutral,positive
120,2024-01-08 10:30:00+00:00,Hard to believe how good ChatGPT has become. Truly remarkable.,tech_tracy,187,145,hard to believe how good chatgpt has become truly remarkable,hard believe good chatgpt become truly remarkable,10,0.8402,positive,0.38611111111111107,0.6305555555555555,positive,positive
122,2024-01-08 13:30:00+00:00,The Mistral demo today was absolutely stunning. Game changer.,data_nerd254,272,35,the mistral demo today was absolutely stunning game changer,mistral demo today absolutely stunning game changer,9,0.4391,positive,0.04999999999999999,0.7,neutral,positive
123,2024-01-08 15:00:00+00:00,Reading about the latest ChatGPT research. Interesting developments.,devmike92,259,164,reading about the latest chatgpt research interesting developments,reading latest chatgpt research interesting developments,8,0.4019,positive,0.5,0.7,positive,positive
124,2024-01-08 16:30:00+00:00,Just tried generative AI and I'm blown away. The future is here!,airesearcher,499,85,just tried generative ai and im blown away the future is here,tried generative ai im blown away future,12,0.0,neutral,0.0,0.125,neutral,neutral
125,2024-01-08 18:00:00+00:00,GitHub Copilot is genuinely changing how I work every single day.,mlops_daily,336,33,github copilot is genuinely changing how i work every single day,github copilot genuinely changing work every single day,11,0.0,neutral,0.1642857142857143,0.35714285714285715,positive,neutral
126,2024-01-08 19:30:00+00:00,machine learning is genuinely changing how I work every single day.,ai_skeptic,564,41,machine learning is genuinely changing how i work every single day,machine learning genuinely changing work every single day,11,0.0,neutral,0.1642857142857143,0.35714285714285715,positive,neutral
127,2024-01-08 21:00:00+00:00,Curious where ChatGPT will be in two years. Anyone have predictions?,data_nerd254,750,184,curious where chatgpt will be in two years anyone have predictions,curious chatgpt two years anyone predictions,11,0.3182,positive,-0.1,1.0,negative,positive
128,2024-01-08 22:30:00+00:00,Attended a talk on OpenAI today. Lots to think about.,cto_musings,465,147,attended a talk on openai today lots to think about,attended talk openai today lots think,10,0.0,neutral,0.0,0.0,neutral,neutral
129,2024-01-09 00:00:00+00:00,Attended a talk on AI tools today. Lots to think about.,airesearcher,558,175,attended a talk on ai tools today lots to think about,attended talk ai tools today lots think,11,0.0,neutral,0.0,0.0,neutral,neutral
130,2024-01-09 01:30:00+00:00,AI tools is the best productivity tool I have used in years.,ai_skeptic,342,79,ai tools is the best productivity tool i have used in years,ai tools best productivity tool used years,12,0.6369,positive,1.0,0.3,positive,positive
131,2024-01-09 03:00:00+00:00,Hard to believe how good generative AI has become. Truly remarkable.,cto_musings,576,38,hard to believe how good generative ai has become truly remarkable,hard believe good generative ai become truly remarkable,11,0.8402,positive,0.38611111111111107,0.6305555555555555,positive,positive
132,2024-01-09 04:30:00+00:00,Privacy concerns around ChatGPT keep growing. Not comfortable using it.,tech_tracy,295,168,privacy concerns around chatgpt keep growing not comfortable using it,privacy concerns around chatgpt keep growing comfortable using,10,-0.2505,negative,-0.2,0.8,negative,negative
133,2024-01-09 06:00:00+00:00,Curious where large language models will be in two years. Anyone have predictions?,pythonista_ke,557,150,curious where large language models will be in two years anyone have predictions,curious large language models two years anyone predictions,13,0.3182,positive,0.057142857142857134,0.7142857142857143,positive,positive
134,2024-01-09 07:30:00+00:00,Using large language models at work now and our output has doubled. Highly recommend.,cto_musings,688,159,using large language models at work now and our output has doubled highly recommend,using large language models work output doubled highly recommend,14,0.4201,positive,0.18714285714285714,0.4842857142857143,positive,positive
135,2024-01-09 09:00:00+00:00,Worried about job displacement because of generative AI. Real conversation needed.,nairobi_dev,627,96,worried about job displacement because of generative ai real conversation needed,worried job displacement generative ai real conversation needed,11,-0.296,negative,0.2,0.30000000000000004,positive,negative
136,2024-01-09 10:30:00+00:00,The OpenAI landscape is changing fast. Hard to keep up.,ai_skeptic,204,98,the openai landscape is changing fast hard to keep up,openai landscape changing fast hard keep,10,-0.1027,negative,-0.04583333333333334,0.5708333333333333,neutral,negative
137,2024-01-09 12:00:00+00:00,GPT-4 just helped me debug a nasty issue in minutes. Love it.,techie_zuri,166,54,gpt4 just helped me debug a nasty issue in minutes love it,gpt4 helped debug nasty issue minutes love,12,0.1531,positive,-0.25,0.8,negative,positive
138,2024-01-09 13:30:00+00:00,Curious where Gemini will be in two years. Anyone have predictions?,tech_tracy,656,22,curious where gemini will be in two years anyone have predictions,curious gemini two years anyone predictions,11,0.3182,positive,-0.1,1.0,negative,positive
139,2024-01-09 15:00:00+00:00,ChatGPT solved a problem in 5 seconds that took me hours before.,data_nerd254,56,135,chatgpt solved a problem in 5 seconds that took me hours before,chatgpt solved problem seconds took hours,12,-0.1531,negative,0.0,0.0,neutral,negative
140,2024-01-09 16:30:00+00:00,ChatGPT is genuinely changing how I work every single day.,ai_skeptic,755,102,chatgpt is genuinely changing how i work every single day,chatgpt genuinely changing work every single day,10,0.0,neutral,0.1642857142857143,0.35714285714285715,positive,neutral
142,2024-01-09 19:30:00+00:00,generative AI is genuinely changing how I work every single day.,pythonista_ke,262,102,generative ai is genuinely changing how i work every single day,generative ai genuinely changing work every single day,11,0.0,neutral,0.1642857142857143,0.35714285714285715,positive,neutral
143,2024-01-09 21:00:00+00:00,Not impressed with machine learning at all. Way too many errors for production.,ai_skeptic,375,144,not impressed with machine learning at all way too many errors for production,impressed machine learning way many errors production,13,-0.6065,negative,0.0,0.75,neutral,negative
144,2024-01-09 22:30:00+00:00,Comparing ChatGPT tools this week. Each has different trade-offs.,airesearcher,684,78,comparing chatgpt tools this week each has different tradeoffs,comparing chatgpt tools week different tradeoffs,9,0.0,neutral,0.0,0.6,neutral,neutral
146,2024-01-10 01:30:00+00:00,ChatGPT still makes too many mistakes to rely on for serious work.,tech_tracy,32,139,chatgpt still makes too many mistakes to rely on for serious work,chatgpt still makes many mistakes rely serious work,12,-0.4215,negative,0.08333333333333334,0.5833333333333333,positive,negative
147,2024-01-10 03:00:00+00:00,Reading about the latest LLMs research. Interesting developments.,tech_tracy,3,18,reading about the latest llms research interesting developments,reading latest llms research interesting developments,8,0.4019,positive,0.5,0.7,positive,positive
148,2024-01-10 04:30:00+00:00,Just tried large language models and I'm blown away. The future is here!,nairobi_dev,639,55,just tried large language models and im blown away the future is here,tried large language models im blown away future,13,0.0,neutral,0.10714285714285714,0.2767857142857143,positive,neutral
149,2024-01-10 06:00:00+00:00,"Watched a demo of artificial intelligence today. Impressive in some areas, limited in others.",techie_zuri,746,83,watched a demo of artificial intelligence today impressive in some areas limited in others,watched demo artificial intelligence today impressive areas limited others,14,0.6705,positive,0.10952380952380954,0.7142857142857143,positive,positive
150,2024-01-10 07:30:00+00:00,GPT-4 still makes too many mistakes to rely on for serious work.,pythonista_ke,524,166,gpt4 still makes too many mistakes to rely on for serious work,gpt4 still makes many mistakes rely serious work,12,-0.4215,negative,0.08333333333333334,0.5833333333333333,positive,negative
151,2024-01-10 09:00:00+00:00,Gemini is genuinely changing how I work every single day.,cto_musings,1,188,gemini is genuinely changing how i work every single day,gemini genuinely changing work every single day,10,0.0,neutral,0.1642857142857143,0.35714285714285715,positive,neutral
152,2024-01-10 10:30:00+00:00,Worried about job displacement because of LLMs. Real conversation needed.,devmike92,59,189,worried about job displacement because of llms real conversation needed,worried job displacement llms real conversation needed,10,-0.296,negative,0.2,0.30000000000000004,positive,negative
153,2024-01-10 12:00:00+00:00,"open source AI is useful for some tasks, not so much for others.",ai_skeptic,694,45,open source ai is useful for some tasks not so much for others,open source ai useful tasks much others,13,0.4404,positive,0.16666666666666666,0.2333333333333333,positive,positive
154,2024-01-10 13:30:00+00:00,generative AI is interesting but I need more time to form a real opinion.,pythonista_ke,693,165,generative ai is interesting but i need more time to form a real opinion,generative ai interesting need time form real opinion,14,0.2144,positive,0.39999999999999997,0.43333333333333335,positive,positive
155,2024-01-10 15:00:00+00:00,Not impressed with GPT-4 at all. Way too many errors for production.,cto_musings,243,23,not impressed with gpt4 at all way too many errors for production,impressed gpt4 way many errors production,12,-0.6065,negative,0.0,0.75,neutral,negative
156,2024-01-10 16:30:00+00:00,Privacy concerns around LLMs keep growing. Not comfortable using it.,techie_zuri,782,15,privacy concerns around llms keep growing not comfortable using it,privacy concerns around llms keep growing comfortable using,10,-0.2505,negative,-0.2,0.8,negative,negative
157,2024-01-10 18:00:00+00:00,Really impressed by ChatGPT! The capabilities are mind-blowing.,tech_tracy,398,138,really impressed by chatgpt the capabilities are mindblowing,really impressed chatgpt capabilities mindblowing,8,0.5256,positive,1.0,1.0,positive,positive
158,2024-01-10 19:30:00+00:00,The progress in machine learning over the last year is absolutely incredible.,tech_tracy,341,140,the progress in machine learning over the last year is absolutely incredible,progress machine learning last year absolutely incredible,12,0.4215,positive,0.45,0.48333333333333334,positive,positive
159,2024-01-10 21:00:00+00:00,Just tried open source AI and I'm blown away. The future is here!,ai_skeptic,255,61,just tried open source ai and im blown away the future is here,tried open source ai im blown away future,13,0.0,neutral,0.0,0.3125,neutral,neutral
160,2024-01-10 22:30:00+00:00,Loving every update to open source AI. The team is crushing it.,ai_skeptic,705,16,loving every update to open source ai the team is crushing it,loving every update open source ai team crushing,12,0.34,positive,0.3333333333333333,0.7833333333333333,positive,positive
161,2024-01-11 00:00:00+00:00,machine learning keeps going down at the worst times. Reliability is a real issue.,pythonista_ke,404,144,machine learning keeps going down at the worst times reliability is a real issue,machine learning keeps going worst times reliability real issue,14,-0.6249,negative,-0.3185185185185185,0.5296296296296297,negative,negative
162,2024-01-11 01:30:00+00:00,artificial intelligence still makes too many mistakes to rely on for serious work.,pythonista_ke,83,68,artificial intelligence still makes too many mistakes to rely on for serious work,artificial intelligence still makes many mistakes rely serious work,13,0.0772,positive,-0.14444444444444443,0.7222222222222222,negative,positive
165,2024-01-11 06:00:00+00:00,Claude is interesting but I need more time to form a real opinion.,tech_tracy,671,199,claude is interesting but i need more time to form a real opinion,claude interesting need time form real opinion,13,0.2144,positive,0.39999999999999997,0.43333333333333335,positive,positive
167,2024-01-11 09:00:00+00:00,The AI tools community is growing fast. Lots of debate about best practices.,techie_zuri,301,81,the ai tools community is growing fast lots of debate about best practices,ai tools community growing fast lots debate best practices,13,0.7096,positive,0.6,0.44999999999999996,positive,positive
168,2024-01-11 10:30:00+00:00,machine learning gave me three different wrong answers. Back to Stack Overflow.,mlops_daily,263,177,machine learning gave me three different wrong answers back to stack overflow,machine learning gave three different wrong answers back stack overflow,12,-0.4767,negative,-0.16666666666666666,0.5,negative,negative
169,2024-01-11 12:00:00+00:00,Incredible what LLMs can do now. We are living in the future.,tech_tracy,721,164,incredible what llms can do now we are living in the future,incredible llms living future,12,0.0,neutral,0.45,0.5125,positive,neutral
171,2024-01-11 15:00:00+00:00,The large language models landscape is changing fast. Hard to keep up.,pythonista_ke,695,15,the large language models landscape is changing fast hard to keep up,large language models landscape changing fast hard keep,12,-0.1027,negative,0.04087301587301586,0.5234126984126983,neutral,negative
175,2024-01-11 21:00:00+00:00,Our company is evaluating ChatGPT for internal use. Early days still.,airesearcher,254,131,our company is evaluating chatgpt for internal use early days still,company evaluating chatgpt internal use early days still,11,0.0,neutral,0.05,0.15,neutral,neutral
176,2024-01-11 22:30:00+00:00,Really impressed by machine learning! The capabilities are mind-blowing.,cto_musings,20,52,really impressed by machine learning the capabilities are mindblowing,really impressed machine learning capabilities mindblowing,9,0.5256,positive,1.0,1.0,positive,positive
177,2024-01-12 00:00:00+00:00,Just tried ChatGPT and I'm blown away. The future is here!,mlops_daily,524,29,just tried chatgpt and im blown away the future is here,tried chatgpt im blown away future,11,0.0,neutral,0.0,0.125,neutral,neutral
179,2024-01-12 03:00:00+00:00,Not impressed with large language models at all. Way too many errors for production.,airesearcher,695,76,not impressed with large language models at all way too many errors for production,impressed large language models way many errors production,14,-0.6065,negative,0.07142857142857144,0.6428571428571429,positive,negative
180,2024-01-12 04:30:00+00:00,Still learning how to get the best results out of Mistral.,techie_zuri,79,8,still learning how to get the best results out of mistral,still learning get best results mistral,11,0.6369,positive,1.0,0.3,positive,positive
182,2024-01-12 07:30:00+00:00,Incredible what Mistral can do now. We are living in the future.,data_nerd254,737,131,incredible what mistral can do now we are living in the future,incredible mistral living future,12,0.0,neutral,0.45,0.5125,positive,neutral
183,2024-01-12 09:00:00+00:00,GitHub Copilot just helped me debug a nasty issue in minutes. Love it.,devmike92,679,23,github copilot just helped me debug a nasty issue in minutes love it,github copilot helped debug nasty issue minutes love,13,0.1531,positive,-0.25,0.8,negative,positive
185,2024-01-12 12:00:00+00:00,The open source AI demo today was absolutely stunning. Game changer.,devmike92,234,180,the open source ai demo today was absolutely stunning game changer,open source ai demo today absolutely stunning game changer,11,0.4391,positive,0.033333333333333326,0.6333333333333333,neutral,positive
187,2024-01-12 15:00:00+00:00,Just tried LLMs and I'm blown away. The future is here!,mlops_daily,381,11,just tried llms and im blown away the future is here,tried llms im blown away future,11,0.0,neutral,0.0,0.125,neutral,neutral
188,2024-01-12 16:30:00+00:00,LLMs still makes too many mistakes to rely on for serious work.,ai_skeptic,502,70,llms still makes too many mistakes to rely on for serious work,llms still makes many mistakes rely serious work,12,-0.4215,negative,0.08333333333333334,0.5833333333333333,positive,negative
190,2024-01-12 19:30:00+00:00,Incredible what deep learning can do now. We are living in the future.,mlops_daily,11,133,incredible what deep learning can do now we are living in the future,incredible deep learning living future,13,0.0,neutral,0.3,0.47500000000000003,positive,neutral
191,2024-01-12 21:00:00+00:00,Our company is evaluating GPT-4 for internal use. Early days still.,tech_tracy,688,61,our company is evaluating gpt4 for internal use early days still,company evaluating gpt4 internal use early days still,11,0.0,neutral,0.05,0.15,neutral,neutral
193,2024-01-13 00:00:00+00:00,ChatGPT is overhyped. Real intelligence is still far away.,ai_skeptic,378,108,chatgpt is overhyped real intelligence is still far away,chatgpt overhyped real intelligence still far away,9,0.4767,positive,0.15000000000000002,0.65,positive,positive
194,2024-01-13 01:30:00+00:00,Using artificial intelligence at work now and our output has doubled. Highly recommend.,devmike92,449,32,using artificial intelligence at work now and our output has doubled highly recommend,using artificial intelligence work output doubled highly recommend,13,0.7089,positive,-0.21999999999999997,0.77,negative,positive
196,2024-01-13 04:30:00+00:00,The hype around LLMs is way overblown. It is just autocomplete.,cto_musings,23,71,the hype around llms is way overblown it is just autocomplete,hype around llms way overblown autocomplete,11,0.0,neutral,0.0,0.0,neutral,neutral
197,2024-01-13 06:00:00+00:00,machine learning is being discussed a lot in our team. No consensus yet.,ai_skeptic,584,197,machine learning is being discussed a lot in our team no consensus yet,machine learning discussed lot team consensus yet,13,-0.296,negative,0.0,0.0,neutral,negative
198,2024-01-13 07:30:00+00:00,Not sure what to make of GitHub Copilot yet. Need more time with it.,pythonista_ke,432,124,not sure what to make of github copilot yet need more time with it,sure make github copilot yet need time,14,-0.2411,negative,0.125,0.6944444444444444,positive,negative
199,2024-01-13 09:00:00+00:00,Gemini is being discussed a lot in our team. No consensus yet.,devmike92,53,140,gemini is being discussed a lot in our team no consensus yet,gemini discussed lot team consensus yet,12,-0.296,negative,0.0,0.0,neutral,negative
201,2024-01-13 12:00:00+00:00,The progress in OpenAI over the last year is absolutely incredible.,mlops_daily,333,71,the progress in openai over the last year is absolutely incredible,progress openai last year absolutely incredible,11,0.4215,positive,0.45,0.48333333333333334,positive,positive
203,2024-01-13 15:00:00+00:00,Attended a talk on LLMs today. Lots to think about.,airesearcher,69,163,attended a talk on llms today lots to think about,attended talk llms today lots think,10,0.0,neutral,0.0,0.0,neutral,neutral
204,2024-01-13 16:30:00+00:00,Claude is genuinely changing how I work every single day.,devmike92,304,59,claude is genuinely changing how i work every single day,claude genuinely changing work every single day,10,0.0,neutral,0.1642857142857143,0.35714285714285715,positive,neutral
